{
  "bead": "spexmachina-9jfk.13",
  "node": "78ac211428bb",
  "files": [
    "spec/validator/test_graph_structure.md",
    "validator/dag_checker_test.go"
  ],
  "claim": "test_graph_structure.md's Setup paragraph says 'DAGChecker fixtures cover eleven shapes' and closes the enumerated list with `empty_arrays`; D10 says 'Three further `dag_profile_*` fixtures pin the edge-set policy down' and names exactly three: `dag_profile_builtin_exempt`, `dag_profile_omits_builtin_edges`, `dag_profile_data_flow_uses_cycle`.",
  "authoritative_source": "validator/testdata/ and validator/dag_checker_test.go, the actual fixture set this test leaf enumerates by name.",
  "evidence": "The tree carries a twelfth DAGChecker fixture, `validator/testdata/dag_profile_cyclic_per_declaring_type`, read by `TestREQ3_CyclicExemptionIsPerDeclaringType` (validator/dag_checker_test.go) — a fourth `dag_profile_*` fixture pinning the edge-set policy (the cyclic exemption is per declaring type, not per edge kind). It arrived with commit 45b973b (bead spexmachina-9jfk.5, schema: ProfileLoader), but neither the Setup paragraph's shape count/list nor D10's three-fixture enumeration was updated to include it, so this leaf under-counts the fixture set it names. spec/ is frozen to implementers, so this bead (spexmachina-9jfk.13, validator: DAGChecker) cannot correct the leaf itself even though its own test file is what surfaces the gap.",
  "blocking": false,
  "proposed_fix": "In the Setup paragraph, change 'eleven shapes' to 'twelve shapes' and add `dag_profile_cyclic_per_declaring_type` to the enumerated fixture list. Under D10, change 'Three further `dag_profile_*` fixtures' to 'Four further' and add a bullet for `dag_profile_cyclic_per_declaring_type`: a profile where both component and data_flow declare a `uses` field but only component's is marked `cyclic: true` — component's self-cycle is exempt while data_flow's own cycle is still caught, pinning that the exemption is tracked per declaring type rather than per edge kind."
}
