{
  "bead": "spexmachina-uiei.13",
  "node": "db90eb607bcb",
  "files": [
    "spec/ingest/arch_ingest_command.md",
    "drifts/drift-spexmachina-uiei.8-plan-exit-codes.json"
  ],
  "claim": "arch_ingest_command.md's Wiring step 3 says 'Open the journal at its resolved location — nothing is read from it yet' and its Non-Responsibilities section says a schema-violating journal line 'ends the run with the file untouched. Which exit code that is depends on where the read sits: in normal mode the first read happens inside reconciliation, so the failure takes the invariant code `2`; in refresh mode it is an input error and exits `1`.' The Exit codes section lists only 0/1/2, with no bullet for the not-a-spex-project code — and its `1` bullet separately names 'missing pre-refresh snapshot in refresh mode' as an input error, which the same pre-flight also makes unreachable.",
  "authoritative_source": "spec/lifecycle/arch_project_resolver.md/test_resolver.md establish that ProjectResolver's pre-flight (`lifecycle.Resolve`) itself reads and validates both the snapshot (`merkle.Load`) and the journal (`mapping.Parse`, through `checkJournalReadable`) before returning either location, and that a missing or unparseable snapshot — like a missing or unparseable journal — is broken project state routed to the not-a-spex-project exit code (3), naming `spex doctor` — the same pattern drift-spexmachina-uiei.8-plan-exit-codes.json already established for `spex plan`.",
  "evidence": "This PR wires IngestCommand's RunE to call `lifecycle.Resolve` once, before branching on --mode (cmd/spex/ingest.go:77), matching arch_ingest_command.md's own instruction that both pathways share one resolution step ahead of the fork. But `lifecycle.Resolve` does not just compute paths: it calls `merkle.Load(snapshotPath)` first, then `checkJournalReadable`, which calls `mapping.Parse` on the journal (lifecycle/project_resolver.go:112,116) — both schema-validate their file. A schema-violating journal or a missing/unparseable pre-refresh snapshot therefore now fails inside `lifecycle.Resolve` and returns exit 3 (wrapped `fmt.Errorf(\"ingest: %w\", err)` at cmd/spex/ingest.go:79) before either the normal-mode reconciliation read, the refresh-mode journal read, or RefreshHandler's own `merkle.Load` failure (ingest/refresh.go:175) is ever reached. That makes Wiring step 3's 'nothing is read from it yet' false for both files — the resolve step itself reads and validates them — and makes unreachable: both exit-1 and exit-2 branches of the Non-Responsibilities schema-violation sentence for the journal, and the Exit codes section's `1` bullet clause 'missing pre-refresh snapshot in refresh mode', since a missing pre-refresh snapshot can no longer reach RefreshHandler's own check via `spex ingest` — it is caught one layer up, at exit 3. The Exit codes section's 0/1/2 list is correspondingly incomplete for the same reason drift-spexmachina-uiei.8-plan-exit-codes.json found in `plan`.",
  "blocking": false,
  "proposed_fix": "Add a fourth Exit codes bullet for the not-a-spex-project code (3) alongside the existing three, matching the resolution drift-spexmachina-uiei.7/drift-spexmachina-uiei.8-plan-exit-codes.json settled on for `plan`. Update Wiring step 3 to say the resolve step performs the snapshot's and the journal's reads (dropping 'nothing is read from it yet'), rewrite the Non-Responsibilities schema-violation sentence to say a schema-violating journal is caught by the lifecycle pre-flight and exits 3 in both modes (removing the now-unreachable per-mode 1/2 split), and drop 'missing pre-refresh snapshot in refresh mode' from the Exit codes `1` bullet — that case is now fully covered by the new not-a-spex-project bullet, since RefreshHandler never reaches its own snapshot read without the pre-flight having already resolved a loadable one."
}
