{
  "bead": "spexmachina-h4gv.33",
  "node": "95a279cbdcbc",
  "files": [
    "spec/merkle/test_diff_classification.md"
  ],
  "claim": "test_diff_classification.md S5 says \"the result contains exactly **3** changes\" for a scenario with one modified leaf, one added leaf and one removed leaf in module beta.",
  "authoritative_source": "The Setup section (line 9) itself, which mandates that the Diff scenarios S1–S5 build both trees from a real setupSpecDir(t) + BuildTree — i.e. real identity hashes and a real module.json on disk, not the abstract placeholder listing.",
  "evidence": "A leaf can only be added or removed by editing module.json's components array, and module.json's raw bytes are hashed as the module's meta envelope leaf (hashLeaf -> HashFile, keyed meta/<module-hash>). So any scenario that adds or removes a component leaf under a real BuildTree necessarily also changes that module's meta/<hash> leaf, dragging a fourth change along beside the three leaf-level changes S5 names. \"Exactly 3\" and \"built from a real setupSpecDir(t) + BuildTree\" cannot both hold for S5's given (one modified + one added + one removed, with the add/remove both in module beta); the correct count under the mandated real-tree setup is 4.",
  "blocking": false,
  "proposed_fix": "Change S5's expected count from 3 to 4, and add a sentence noting that the added/removed pair in the same module also modifies that module's meta/<hash> envelope leaf, mirroring the explanation already given for E3's project-level meta/project caveat."
}
