{
  "bead": "spexmachina-f6eh.44",
  "node": "338edabe0796",
  "files": [
    "spec/plan/test_changeset_builder.md",
    "spec/plan/arch_changeset_builder.md",
    "spec/plan/flow_plan.md"
  ],
  "claim": "test_changeset_builder.md, \"Canonical schema and field order\", first bullet: canonical field order on every op includes `spec_hash` \"since creates carry it as well as retargets\" — asserting that a conventional create op populates spec_hash on the wire, not just its field-order slot.",
  "authoritative_source": "arch_changeset_builder.md's \"Op Shape\" JSON example (a conventional create) and its \"Cleanup op shape\" / \"Modify-pair creates\" prose omit spec_hash entirely; flow_plan.md's worked example (op-2, a conventional create) likewise carries no spec_hash key, while op-3 (a retarget) does. Both leaves are unchanged by the same drift-fix pass that added this clause to test_changeset_builder.md, and plan/builder.go's createOp() (shipped, reviewed, closed under spexmachina-f6eh.42) never copies Action.SpecHash onto a conventional create's Op — only retargetOp() does.",
  "evidence": "The two claims cannot both hold: either a conventional create's JSON carries a populated spec_hash field (test_changeset_builder.md's claim) or it never does (arch_changeset_builder.md's example + flow_plan.md's example + the shipped builder.go). A test literally following test_changeset_builder.md's clause — asserting spec_hash appears in a single-create batch's op JSON — fails against the existing, already-correct implementation. The canonical-field-order rule reads more naturally as a fixed struct field ORDER that each op kind writes its own subset of (spec_hash's slot exists whether or not a given op populates it), and every other leaf and the shipped code agree only retarget populates it; the \"since creates carry it as well as retargets\" clause looks like an authoring slip introduced while an unrelated retarget-ordering fix (f6eh.13) was being applied across this same paragraph.",
  "blocking": false,
  "proposed_fix": "Drop the trailing clause \"— the one sequence every op kind writes its own subset of, `spec_hash` included, since creates carry it as well as retargets\" from test_changeset_builder.md's first canonical-schema bullet, or reword it to state plainly that spec_hash's position in the sequence is fixed but only retarget (and no create shape) populates it, matching arch_changeset_builder.md's Op Shape example and flow_plan.md's worked example."
}
